uri	name	type	synonyms	definition	resource	wikipedia
https://www.wikidata.org/wiki/Q520833	labium width	length/width	labial width, labia width	A lower mouthpart of an insect that is formed by the second pair of maxillae united in the middle line	Wikiworld	https://en.wikipedia.org/wiki/Arthropod_mouthparts#Labium
https://www.wikidata.org/wiki/Q360768	labrum width	length/width	labral width, labra width	Flap-like structure that lies immediately in front of the mouth, upper lip of an insect mouth	Wikiworld	https://en.wikipedia.org/wiki/Labrum_(arthropod_mouthpart)
https://www.wikidata.org/wiki/Q133105	leg width	length/width	limb width	The complete leg	Wikiworld	https://en.wikipedia.org/wiki/Arthropod_leg
https://www.wikidata.org/wiki/Q920112	mandible width	length/width	mandibular width, mouthparts width, mouth	A pair of mouthparts, jaws	Wikiworld	https://en.wikipedia.org/wiki/Mandible_(arthropod_mouthpart)
https://www.wikidata.org/wiki/Q350956	maxilla width	length/width	maxillae width, maxillary width	The paired structures that make up the mandible	Wikiworld	https://en.wikipedia.org/wiki/Maxilla_(arthropod_mouthpart)
https://en.wiktionary.org/wiki/merus	merus width	length/width	meral width, meri width	Fourth segment of crustacean legs	Wikiworld	https://en.wikipedia.org/wiki/Arthropod_leg
https://www.wikidata.org/wiki/Q1461105	mesosoma width	length/width	mesosomal width	The middle part of the body of arthropods whose body is composed of three parts	Wikiworld	https://en.wikipedia.org/wiki/Mesosoma
https://www.wikidata.org/wiki/Q602075	metasoma width	length/width	metasomal width	The posterior part of the body of arthropods whose body is composed of three parts	Wikiworld	https://en.wikipedia.org/wiki/Metasoma
https://www.wikidata.org/wiki/Q66516345	metatarsus width	length/width	metatarsal width, basitarsus width, metatarsi width	Sixth segment of chelicerate legs	Wikiworld	https://en.wikipedia.org/wiki/Arthropod_leg
https://en.wiktionary.org/wiki/midleg	midleg width	length/width	middle width-leg	Middle pair of insect legs	Wikiworld	https://en.wikipedia.org/wiki/Arthropod_leg
https://en.wiktionary.org/wiki/ocellus#English	ocellus width	length/width	ocelli width, width ocellar	A simple eye consisting of a single lens and a small number of sensory cells	Wikiworld	https://en.wiktionary.org/wiki/ocellus
https://en.wiktionary.org/wiki/opisthosoma	opisthosoma width	length/width	opisthosomal width	Posterior part of the body in some arthropods, behind the prosoma - cephalothorax	Wikiworld	https://en.wikipedia.org/wiki/Opisthosoma
https://www.wikidata.org/wiki/Q868460	ovipositor width	length/width	ovipositors width	A tube-like organ used by some animals, especially insects, for the laying of eggs	Wikiworld	https://en.wikipedia.org/wiki/Ovipositor
https://www.wikidata.org/wiki/Q7135191	paramere width	length/width	parameres width	Part of the external reproductive organs of male insects	Wikiworld	https://en.wikipedia.org/wiki/Paramere
https://en.wiktionary.org/wiki/patella	patella width	length/width	patellar width, patellae width	Fourth segment of chelicerate legs	Wikiworld	https://en.wikipedia.org/wiki/Arthropod_leg
https://www.wikidata.org/wiki/Q932179	pedipalp width	length/width	palp width, palpi width	The second pair of appendages of chelicerates	Wikiworld	https://en.wikipedia.org/wiki/Pedipalp
https://www.wikidata.org/wiki/Q58	phallus width	length/width	phallic width, penis width, penile width	Male reproductive organ	Wikiworld	https://en.wikipedia.org/wiki/Aedeagus
https://www.wikidata.org/wiki/Q899348	proboscis width	length/width	proboscises width, proboscides width	A tubular feeding and sucking organ	Wikiworld	https://en.wikipedia.org/wiki/Proboscis#Invertebrates
https://en.wiktionary.org/wiki/pronotum	pronotum width	length/width	pronotal width, pronota width	A prominent plate-like structure that covers all or part of the thorax of some insects	Wikiworld	https://en.wikipedia.org/wiki/Prothorax
https://www.wikidata.org/wiki/Q3133438	propodus width	length/width	propodal width	Sixth segment of crustacean legs	Wikiworld	https://en.wikipedia.org/wiki/Dactylus
https://www.wikidata.org/wiki/Q3407707	prosoma width	length/width	prosomal width	A tagma of various arthropods comprising the head and the thorax fused together	Wikiworld	https://en.wikipedia.org/wiki/Cephalothorax
https://www.wikidata.org/wiki/Q123439	prothorax width	length/width	prothoracic width	The foremost of the three segments in the thorax of an insect	Wikiworld	https://en.wikipedia.org/wiki/Prothorax
https://www.wikidata.org/wiki/Q1048843	pterostigma width	length/width	pterostigmata width, pterostigmal width	A group of specialized cells in the outer wings of insects	Wikiworld	https://en.wikipedia.org/wiki/Pterostigma
https://en.wiktionary.org/wiki/ramus	ramus width	length/width	ramal width, rami width	External branch of limbs	Wikiworld	https://en.wikipedia.org/wiki/Arthropod_leg
https://www.wikidata.org/wiki/Q2233438	rostrum width	length/width	rostral width, rostra width	The forward extension of the carapace in front of the eyes	Wikiworld	https://en.wikipedia.org/wiki/Rostrum_(anatomy)
https://www.wikidata.org/wiki/Q2094206	scutellum width	length/width	scutellar width, scutella width	Posterior portion of mesonotum of an insect thorax	Wikiworld	https://en.wikipedia.org/wiki/Scutellum_(insect_anatomy)
https://www.wikidata.org/wiki/Q1777684	sternum width	length/width	sternal width, sterna width	The ventral portion of a segment of an arthropod thorax or abdomen	Wikiworld	https://en.wikipedia.org/wiki/Sternum_(arthropod_anatomy)
https://www.wikidata.org/wiki/Q476820	tarsus width	length/width	tarsal width, tarsi width	Segment of arthropod leg	Wikiworld	https://en.wikipedia.org/wiki/Arthropod_leg#Tarsus
https://www.wikidata.org/wiki/Q952557	telson width	length/width	telsonal width, telsonic width	The posterior-most division of the body of an arthropod	Wikiworld	https://en.wikipedia.org/wiki/Telson
https://www.wikidata.org/wiki/Q652546	tergum width	length/width	tergal width, terga width	The dorsal portion of an arthropod segment other than the head	Wikiworld	https://en.wikipedia.org/wiki/Tergum
https://www.wikidata.org/wiki/Q942508	thorax width	length/width	thoracic width, thoraces width	The midsection of the insect body also called mesosoma or cephalothorax	Wikiworld	https://en.wikipedia.org/wiki/Thorax_(arthropod_anatomy)
https://www.wikidata.org/wiki/Q2035874	tibia width	length/width	tibiae width, tibial width	Segment of arthropod leg	Wikiworld	https://en.wikipedia.org/wiki/Arthropod_leg#Tibia
https://en.wiktionary.org/wiki/trochanter	trochanter width	length/width		Segment of arthropod leg	Wikiworld	https://en.wikipedia.org/wiki/Arthropod_leg#Trochanter
https://www.wikidata.org/wiki/Q161358	wing width	length/width		Complete wing	Wikiworld	https://en.wikipedia.org/wiki/Insect_wing
http://www.wikidata.org/entity/Q245097	wingspan width	length/width		distance from the tip of one limb such as an arm or wing to the tip of the paired limb, or analogically the same measure for airplane wings	Wikiworld	https://en.wikipedia.org/wiki/Wingspan
						
						
Body Parts (counts, 0=absent)						
http://purl.obolibrary.org/obo/BTO_0000074	antenna	count	antennae	Paired appendages used for sensing in arthropods	BRENDA tissue / enzyme source	https://en.wikipedia.org/wiki/Antenna_(biology)
http://purl.obolibrary.org/obo/IDOMAL_0002229	apposition eye	count	apposition eyes	A compound eye with no separation between the crystalline-cone layer and the retinula, each rhabdom receiving light only from its own corneal lens.	Malaria Ontology	https://en.wikipedia.org/wiki/Compound_eye#Apposition_eyes
http://purl.obolibrary.org/obo/BTO_0001701	carapace	count		A bony or chitinous case or shield covering the back or part of the back of an animal (as a turtle or crab).	BRENDA tissue / enzyme source	https://en.wikipedia.org/wiki/Carapace
http://purl.obolibrary.org/obo/AISM_0004165	cercus	count	cerci	Paired appendages on the rear-most segments of many arthropods	Ontology for the Anatomy of the Insect SkeletoMuscular system (AISM)	https://en.wikipedia.org/wiki/Cercus
http://purl.obolibrary.org/obo/UBERON_0000018	compound eye	count	compound eyes	A light sensing organ composed of multiple ommatidia, visual units consisting of a limited number of rhabdomeric photoreceptor cells, cornea-secreting epithelial cells, interommatidial pigment cells, and sometimes crystalline cone cells	UBERON	https://en.wikipedia.org/wiki/Compound_eye
http://purl.obolibrary.org/obo/BTO_0000378	elytron	count	elytra	A modified, hardened forewing of certain insect orders	BRENDA tissue / enzyme source	https://en.wikipedia.org/wiki/Elytron
http://purl.obolibrary.org/obo/UBERON_0000970	eye	count	eyes	Visual organ	UBERON	https://en.wikipedia.org/wiki/Arthropod_eye
http://purl.obolibrary.org/obo/BTO_0001604	eyestalk	count	eyestalks	A protrusion that extends an eye away from the body	BRENDA tissue / enzyme source	https://en.wikipedia.org/wiki/Eyestalk
http://purl.obolibrary.org/obo/UBERON_0002535	gill	count	gills	A respiratory organ found in many aquatic organisms that extracts dissolved oxygen from water	UBERON	https://en.wikipedia.org/wiki/Gill
http://purl.obolibrary.org/obo/TGMA_0000526	gonopod	count	gonopods	Specialized appendages of various arthropods used in reproduction or egg-laying	Mosquito gross anatomy ontology	https://en.wikipedia.org/wiki/Gonopod
http://purl.obolibrary.org/obo/UBERON_0000987	haltere	count	halteres	A pair of small club-shaped organs on the body of some flying insects	UBERON	https://en.wikipedia.org/wiki/Halteres
https://en.wiktionary.org/wiki/hemelytron	hemelytron	count	hemelytra, hemelytrum, hemielytra	An insect's forewing with both membranous and hardened portions	Wikiworld	https://en.wiktionary.org/wiki/hemelytron
http://purl.obolibrary.org/obo/UBERON_0006967	horn	count		Pointed projection on the head of various animals	UBERON	https://en.wikipedia.org/wiki/Horn_(anatomy)
http://purl.obolibrary.org/obo/UBERON_0000978	leg	count	limbs, legs	A leg is a weight-bearing and locomotive anatomical structure, usually having a columnar shape.	UBERON	https://en.wikipedia.org/wiki/Leg#Limb
http://purl.obolibrary.org/obo/BTO_0001758	ocellus	count	simple eyes, ocelli	small simple eyes, found in many invertebrates, usually consisting of a few sensory cells and a single lens	BRENDA tissue / enzyme source	https://en.wikipedia.org/wiki/Simple_eye_in_invertebrates#Ocelli_or_eye_spots
http://purl.obolibrary.org/obo/UBERON_2002117	ovipositor	count	ovipositors	A tube-like organ used by some animals, especially insects, for the laying of eggs	UBERON	https://en.wikipedia.org/wiki/Ovipositor
http://purl.obolibrary.org/obo/BTO_0001117	proboscis	count	proboscises, proboscides	A tubular feeding and sucking organ	BRENDA tissue / enzyme source	https://en.wikipedia.org/wiki/Proboscis#Invertebrates
http://purl.obolibrary.org/obo/HAO_0000957	pterostigma	count	pterostigmata	A group of specialized cells in the outer wings of insects	Hymenoptera Anatomy Ontology	https://en.wikipedia.org/wiki/Pterostigma
http://purl.obolibrary.org/obo/IDOMAL_0002230	superposition eye	count	superposition eyes	refracting, reflecting and parabolic superposition eyes	Malaria Ontology	https://en.wikipedia.org/wiki/Eye#Superposition_eyes
http://purl.obolibrary.org/obo/BTO_0002098	tympanal organ	count	tympanum	hearing organ in insects, consisting of a membrane (tympanum) stretched across a frame backed by an air sac and associated sensory neurons	BRENDA tissue / enzyme source	https://en.wikipedia.org/wiki/Tympanal_organ
http://purl.obolibrary.org/obo/UBERON_0000023	wing	count	wings	Complete wing	UBERON	https://en.wikipedia.org/wiki/Insect_wing
						
						
Body Features (terms used to describe)						
http://eol.org/schema/terms/apterous	apterous	yes/no	wingless	Wings are absent	Encyclopedia of Life	https://en.wikipedia.org/wiki/Aptery
http://purl.obolibrary.org/obo/UBERON_0016490	auditory system	yes/no	hearing system, hearing organ	is the sensory system for the sense of hearing	UBERON	https://en.wikipedia.org/wiki/Auditory_system
http://eol.org/schema/terms/Bioluminescent	bioluminescent	yes/no	bioluminescence	Has this organism been observed to produce and transmit light?	Encyclopedia of Life	http://en.wikipedia.org/wiki/Bioluminescence
https://www.wikidata.org/entity/Q10874	blind	yes/no	sightless	complete or nearly complete lack of vision	WikiData	https://en.wiktionary.org/wiki/blind
http://eol.org/schema/terms/brachypterous	brachypterous	yes/no	nonfunctional wings, reduced wings, microptery, micropterous	The presence of short wings, not functional as organs of flight	Encyclopedia of Life	https://en.wikipedia.org/wiki/Brachyptery
http://eol.org/schema/terms/hasWings	has wings	yes/no	winged	Wings are present	Encyclopedia of Life	https://en.wikipedia.org/wiki/Wing
http://eol.org/schema/terms/secondarilyApterous	secondarily apterous	yes/no	secondarily wingless	The absence of wings in organisms that are descended from winged ancestors	Encyclopedia of Life	https://en.wikipedia.org/wiki/Aptery
https://en.wiktionary.org/wiki/aristate	aristate antenna	yes/no	aristate antennae	Having a slender, sharp, or spiny tip.	Wikiworld	
https://en.wiktionary.org/wiki/lamellate	lamellate antenna	yes/no	lamellate antennae	This term is used especially to describe certain insect antennae in which the last segments are so shaped into a compact club of flat plates	Wikiworld	
https://en.wiktionary.org/wiki/serrate	serrate antenna	yes/no	serrate antennae	Having tooth-like projections on one side, as in a saw	Wikiworld	
https://en.wiktionary.org/wiki/flabellate	flabellate antenna	yes/no	flabellate antennae	Fan-shaped; having parts or segments that are flattened and lengthened on one side, such that they are long and narrow	Wikiworld	
https://en.wiktionary.org/wiki/moniliform	moniliform antenna	yes/no	moniliform antennae	Having a form resembling a string of beads, where the component parts or segments are more or less uniform in size and are spherical or rounded in shape	Wikiworld	
https://en.wiktionary.org/wiki/setaceous	setaceous antenna	yes/no	setaceous antennae	Of, relating to, or resembling a seta or bristle; bristly	Wikiworld	
https://en.wiktionary.org/wiki/geniculate	geniculate antenna	yes/no	geniculate antennae	Having kneelike joints; able to bend at an abrupt angle	Wikiworld	
https://en.wiktionary.org/wiki/plumose	plumose antenna	yes/no	plumose antennae, feathery antennae, plumelike antennae	Having hairs, or other parts, arranged along an axis like a feather	Wikiworld	
https://en.wiktionary.org/wiki/pectinate	pectinate antenna	yes/no	pectinate antennae	Having segments which are greatly lengthened to one side	Wikiworld	
https://en.wiktionary.org/wiki/clavate	clavate antenna	yes/no	clavate antennae, claviform antennae, clubbed antennae	Resembling a club, becoming increasingly wide from the base to the distal end	Wikiworld	
https://en.wiktionary.org/wiki/stylate	stylate antenna	yes/no	stylate antennae, styliform antennae	A small, thin, pointed body part	Wikiworld	